{
  "schemaVersion": "ofarm.queryplanir.v0.1",
  "planId": "plan:field-passport-current-v1",
  "sourceQuerySpecificationId": "query:field-passport-current-v1",
  "normalizedTarget": {
    "twin": "COMPLIANCE",
    "anchorScopes": [
      {
        "scopeType": "FIELD",
        "scopeRef": "field:123"
      }
    ],
    "evaluationTimePolicy": {
      "policyType": "NOW"
    },
    "contextSnapshotRef": "ctx:field-passport:v1",
    "authorityContextHash": "ahash:field-passport-view-v1"
  },
  "resolvedPathAliases": [
    {
      "alias": "cropStage",
      "rootVar": "cycle",
      "pathRef": "/phenology/stage",
      "resolvedToType": "GOVERNED_CONTENT_NODE",
      "resolvedRef": "node:cropCyclePhenologyStage",
      "resolutionVersionRef": "alias:cropStage:v1"
    }
  ],
  "executionSteps": [
    {
      "stepId": "step:1",
      "executorType": "CURRENT_STATE_MATERIALIZATION",
      "operationType": "MATCH",
      "inputBindings": [],
      "outputBindingSetId": "bindings:field-cycle",
      "targetRef": "mat:field-current",
      "freshnessRequirement": "ALLOW_STALE_EXPLORATORY"
    },
    {
      "stepId": "step:2",
      "executorType": "SEMANTIC_GRAPH",
      "operationType": "PROJECT",
      "inputBindings": [
        "field",
        "cycle"
      ],
      "outputBindingSetId": "bindings:projected"
    },
    {
      "stepId": "step:3",
      "executorType": "READ_MODEL",
      "operationType": "RESHAPE",
      "inputBindings": [
        "field",
        "cycle",
        "cropStage"
      ],
      "outputBindingSetId": "bindings:view-ready",
      "targetRef": "view:field_passport_core_v1"
    }
  ],
  "materializationPolicy": {
    "requiredFreshness": "ALLOW_STALE_EXPLORATORY",
    "highConsequenceUse": false
  },
  "equivalenceRequirements": {
    "semanticEquivalenceRequired": true,
    "projectionTraceBackRequired": true
  },
  "outputAssembly": {
    "mode": "VIEW_MODULE",
    "viewModuleRef": "view:field_passport_core_v1"
  }
}